{
  "schema_version": "1.0",
  "event_id": "0198ef21-0003-7000-8000-000000000001",
  "event_type": "solana.business_outcome.observed",
  "occurred_at": "2026-08-29T12:00:00Z",
  "project_id": "0198ef00-0000-7000-8000-000000000100",
  "environment_id": "0198ef00-0000-7000-8000-000000000200",
  "business_action_id": "0198ef21-0003-7000-8000-000000000100",
  "source": { "kind": "application", "name": "swap-worker", "version": "0.1.0" },
  "privacy_mode": "standard",
  "privacy_policy_version": "1.0",
  "redaction_version": "1.0",
  "attributes": { "outcome": "failure", "detail": "[REDACTED]" }
}
